{
  "direction": "Long-horizon tool-use planning for LLM agents",
  "constraints": [
    "Prefer open datasets",
    "Two-week prototype window"
  ],
  "resources": {
    "compute": "8xA100 for peak runs",
    "team": "1-2 researchers",
    "time_budget_weeks": 12
  },
  "target_venues": ["ICLR", "NeurIPS"],
  "forbidden_items": ["Closed proprietary datasets"],
  "language": "zh",
  "created_at": "2026-05-14T00:00:00Z"
}
